date,tweet
2020-10-08 02:23:32,"RT @KamalaHarris: Just last ​week,​ Donald Trump stood on a​ debate stage ​and refused to condemn white supremacists.

This isn’t the first…"
2020-10-08 02:16:33,RT @KamalaHarris: Donald Trump has betrayed our friends and embraced dictators around the world. https://t.co/ZHw9VeSTaL
2020-10-08 02:15:14,RT @KamalaHarris: The American people want us to fill a seat right now—but it’s not on the Supreme Court; it’s the one in the Oval Office.
2020-10-08 02:10:39,"RT @KamalaHarris: Donald Trump called John McCain a “loser.”

He let Putin get away with placing bounties on the heads of our troops.

He c…"
2020-10-08 02:01:22,RT @KamalaHarris: Donald Trump prefers to take the word of Vladimir Putin over that of the American intelligence community.
2020-10-08 01:53:30,RT @KamalaHarris: Joe Biden is responsible for saving America's auto industry. And Mike Pence voted against it. So let's set the record str…
2020-10-08 01:53:25,"RT @KamalaHarris: If you have a pre-existing condition, the Trump administration is coming for you. https://t.co/mf6fux03nR"
2020-10-08 01:49:07,"Let me be clear: A Biden-Harris Administration won't increase taxes by a dime on anyone making less than $400,000 a year."
2020-10-08 01:42:44,RT @KamalaHarris: .@JoeBiden and I believe the economy is doing well when our workers and our families are doing well. That’s why our tax p…
2020-10-08 01:38:03,RT @KamalaHarris: The day @JoeBiden asked me to serve with him was one of the most memorable days of my life. My mother—who came to the Uni…
2020-10-08 01:37:57,"RT @KamalaHarris: Donald Trump paid $750 in taxes. When I first heard about it, I literally said, “You mean $750,000?”"
2020-10-08 01:28:17,".@KamalaHarris is showing the American people why I chose her as my running mate. She’s smart, she’s experienced, she’s a proven fighter for the middle class. She’ll be an incredible Vice President."
2020-10-08 01:24:54,"RT @KamalaHarris: Over 210,000 Americans have died. Over 7 million have contracted this disease. Nearly 30 million have filed for unemploym…"
2020-10-08 01:18:48,"RT @KamalaHarris: Trump didn’t share information about the virus because he wanted you to stay calm. 

I want to ask you: how calm were you…"
2020-10-08 01:13:31,"We’re eight months into this pandemic and Donald Trump and Mike Pence still have no plan to deal with COVID-19. He’s still hoping it will just “disappear.”

@KamalaHarris and I have a comprehensive, science-backed plan to defeat this virus.

Take a look: https://t.co/xjxsDn2qCD"
2020-10-08 01:13:10,RT @KamalaHarris: How Donald Trump and Mike Pence handled the coronavirus crisis is the greatest failure of any American presidency.
2020-10-08 00:40:00,".@KamalaHarris is about to take the debate stage –– but before she does, I need your help.

Will you chip in to make sure Kamala knows you’ve got her back as she takes on Vice President Pence? https://t.co/QwFRpbMJVC"
2020-10-08 00:31:26,"Before @KamalaHarris steps on stage, tune in for a pre-debate event with @MindyKaling, @PadmaLakshmi, @DJCassidy, and more. https://t.co/SByDx8O8lu"
2020-10-07 23:52:00,"Go get 'em, @KamalaHarris. https://t.co/L0YHko1WmA"
2020-10-07 23:05:00,"We can end this era of division.

We can end the hate and the fear.

We can be what we are at our best: one America. https://t.co/ZaUKw91eLZ"
2020-10-07 22:16:00,"Taylor — Thanks for your support and for speaking out at this crucial moment in our nation’s history.

Election Day is right around the corner — are you ready for it? 

https://t.co/eoxT07d7QB https://t.co/TLHRYSjbTx"
2020-10-07 20:46:23,"RT @GreenfieldIowa: Voting has started in Iowa! Go to https://t.co/7Sh60D1SlF to make your plan to vote. Together, we can flip this #IASen…"
2020-10-07 20:22:00,"Folks, I know a thing or two about vice presidential debates.

In 2008, I squared off against Governor Palin. And in 2012, I called out Congressman Ryan's malarkey.

I know @KamalaHarris will do a great job. Join me and tune in at 9 PM ET to cheer her on."
2020-10-07 19:21:00,RT @TheDemocrats: Tonight’s the night. Who’s ready? We know @KamalaHarris is. https://t.co/U8hIpXKLn8
2020-10-07 18:55:00,"These families fled persecution and violence to seek safety in the land of the free.

But instead of providing refuge, the Trump Administration ripped their children away from them.

The cruelty was the point — and it's reprehensible. https://t.co/uU3q2EW6vO"
2020-10-07 18:40:00,Arizona — in-person early voting starts today. Head to https://t.co/2fKBLSnZP2 to find all the info you need to cast your ballot.
2020-10-07 18:24:00,"Missouri — today is your last day to register to vote online, in person, or by mail.

Don’t miss your opportunity to help determine the future of this country. Head to https://t.co/lDI7PzhWha and get registered today."
2020-10-07 17:46:50,"RT @CaptMarkKelly: Today is the first day of early voting, Arizona. Find out when and where you can vote at https://t.co/20w58Bx9ha. https:…"
2020-10-07 16:40:00,"Together, we can set our nation on a new path. One where we finally live up to our highest ideals and everyone gets a fair shot to get ahead.

Let's do this: https://t.co/eoxT07uII9 https://t.co/FgIInBkXBE"
2020-10-07 15:17:12,RT @BarackObama: .@JoeBiden has a plan to build our country back better and create millions of jobs—jobs that can help working families get…
2020-10-07 14:10:00,"As president, I will:

- Implement nationwide mask mandates
- Ensure access to regular, reliable, and free testing
- Accelerate the development of treatments and vaccines

I won’t waste any time getting this virus under control."
2020-10-07 13:50:11,RT @KamalaHarris: Masks save lives. https://t.co/ZvgjQsCQay
2020-10-07 13:49:51,RT @TheDemocrats: Here are some things to think about as you make your voting plan. Plan ahead and get ready to vote. https://t.co/ZKn8fJEh…
2020-10-07 02:12:00,Please. https://t.co/acHR1Rf8hE
2020-10-07 01:30:00,"I can’t wait for @KamalaHarris to make history at tomorrow night’s debate. Before she takes the stage, don’t miss this event with @MindyKaling, @PadmaLakshmi, @DJCassidy, and more.

RSVP today: https://t.co/wsuSsUPyI5"
2020-10-07 01:05:00,"Ignore the polls, folks. There’s too much at stake for us to get complacent.

Vote: https://t.co/eoxT07uII9
Donate: https://t.co/AerPVVAHh6
Volunteer: https://t.co/RSMKrK1QZy

Let’s finish these final four weeks strong. https://t.co/Dp0t05dzJZ"
2020-10-07 00:46:00,"Think about what it takes for a Black person to love America. 

That is a deep love for this country that, for far too long, we have never recognized. https://t.co/vTEY156VTj"
2020-10-07 00:15:00,"Look, folks, I'm going to be honest: we'll try pretty much anything to get you to vote this election. My team spun up this quiz to match your personality to an easy voting option. Check it out — but more importantly, vote! https://t.co/TH6ShPiapc"
2020-10-06 23:20:00,"Four weeks from today, voters will head to the polls to determine the outcome of the most important election of our lifetime.

We don’t have a minute to waste — and we need your help to win. Chip in: https://t.co/nx01UKHIyn"
2020-10-06 23:05:00,"Climate change is already here, and ignoring science won't make it go away. If we give the Trump Administration another four years, we'll lose irreplaceable time to combat it. https://t.co/cexxSVQLOQ"
2020-10-06 22:50:00,"Make no mistake: if you are out of work, if your business is closed, if your child’s school is shut down, if you are seeing layoffs in your community, Donald Trump decided today that none of that matters to him."
2020-10-06 22:32:36,"RT @DrBiden: #ImVotingFor military families, veterans, caregivers, and survivors. https://t.co/K3N1BGpYS8"
2020-10-06 22:32:00,The President turned his back on you. https://t.co/oeI8dck2LL
2020-10-06 21:02:00,"I give you my word: If I am elected president, I will marshal the ingenuity and goodwill of this nation to turn division into unity and bring us together."
2020-10-06 20:54:00,"As president, I will embrace:

Hope, not fear.
Peace, not violence.
Generosity, not greed.
Light, not darkness. 

I will be a president who appeals to the best in us. Not the worst."
2020-10-06 20:52:00,"We fought a Civil War that would secure a Union that would seek to fulfill the promise of equality for all.

And by fits and starts, our better angels have prevailed just enough against our worst impulses to make a new and better nation.

Those better angels must prevail again."
2020-10-06 20:49:00,"The pandemic is not a red state versus blue state issue. The virus doesn’t care where you live or what political party you belong to.

It infects us all. It will take anyone’s life. It is a virus — not a political weapon."
2020-10-06 20:45:00,I do not believe we have to choose between law and order and racial justice in America.
2020-10-06 20:44:00,"As president, I will send a clear, unequivocal message to the entire nation: There is no place for hate in America.

It will be given no license. It will be given no oxygen. It will be given no safe harbor."
2020-10-06 20:29:43,We are engaged once again in a battle for the soul of the nation. It’s a battle we’ve been in before and we can win again. Tune in as I deliver remarks from Gettysburg. https://t.co/I9KItf8Fjn
2020-10-06 20:06:17,"RT @TeamJoe: New Mexico! 🌵

Today is the last day to register to vote! 

You can also register before you early vote in person.

Make sure…"
2020-10-06 19:49:07,"RT @TeamJoe: Hey, Nevada!

This is your last day to register to VOTE via mail. 

Let your voice be heard. 

You can also register to vote o…"
2020-10-06 19:49:05,"RT @TeamJoe: Hey, Illinois! 👋🏿👋🏻👋🏼👋🏽👋🏾

Today is the last day for you to register to vote via mail! 

You can also register online until Oc…"
2020-10-06 18:19:00,Unity over division.
2020-10-06 17:40:00,"Florida — la decisión de hoy de extender la fecha para inscribirse para votar es una victoria para nuestra democracia. Si no te has registrado, visita https://t.co/SSNUK7cjLs antes de las 7 PM ET e inscríbete.

Esta elección es demasiado importante para no participar."
2020-10-06 17:27:00,"Florida — today's decision to extend the voter registration deadline is a win for our democracy. If you haven't registered to vote yet, head to https://t.co/uAcduFQlKF before 7 PM ET tonight to do so.

This election is too important to sit out."
2020-10-06 16:17:46,"RT @KamalaHarris: #ImVotingFor people like my mother, Shyamala, who taught my sister and me that if you see a problem, you don't complain a…"
2020-10-06 16:15:00,"Folks, we can save nearly 100,000 lives by the end of the year if everyone wears a mask in public.

Do your part. Protect your neighbors. Wear a mask."
2020-10-06 15:00:02,"#ImVotingFor Shamar — and every kid in this country — because they deserve the chance to go as far as their God-given potential will take them.

What are you voting for? I want to hear from you @BarackObama, @MichelleObama, and @DrBiden. https://t.co/4iZaKwDzzY"
2020-10-06 13:01:04,"There’s no better person to convey what’s at stake in this election than my friend, @MichelleObama. Tune in to hear her closing argument. https://t.co/wc7mywLUHy"
2020-10-06 03:24:50,"I couldn’t let #WorldTeachersDay go by without celebrating the best teacher I know. Jilly, the way you’ve worked tirelessly and passionately for your students year after year continues to inspire me. https://t.co/rvCJHZLFvm"
2020-10-06 02:27:00,Wear a mask. https://t.co/TSuLuzAXEB
2020-10-06 01:22:00,"Folks, I just wrapped up my NBC Town Hall where I laid out my plans to build this country back better than before. If you liked what you heard, please chip in to keep tonight's momentum going: https://t.co/2QUVJ3rvkU"
2020-10-06 01:17:00,The future is yours. I'm counting on you. https://t.co/4vpSkat0ZH
2020-10-06 01:15:00,I've taken on the Castros and Putins of the world. I let them know: it stops here. It stops with me. It stops with me as president. https://t.co/p2p1n4ALRY
2020-10-06 01:02:00,Roe v. Wade must remain the law of the land. https://t.co/1Gq6Ncc2IK
2020-10-06 00:51:00,Don't tell me things can't change. https://t.co/S1L2zcKVFr
2020-10-06 00:47:00,"As president, I'll do what I've always done in the past: bring people together.

Peaceful protesters, police officers, unions, and civil rights groups — we'll all sit down at the White House. https://t.co/qk4Nh65UIC"
2020-10-06 00:34:00,"When I decided to run, I had three objectives:

1. Restore the soul of this country.
2. Rebuild the middle class.
3. Reunite the country.

It's the only way we can move forward. https://t.co/Wk3uP0Qcqm"
2020-10-06 00:31:00,"More than 200,000 Americans have died. 50,000 Americans are getting the virus every day. 1,000 a day are dying. This is a national emergency.

The President should take responsibility. https://t.co/RpEZCjjUhq"
2020-10-06 00:24:00,Listen to the scientists.
2020-10-06 00:22:00,I would hope that the President having gone through what he went through will communicate the right lesson to the American people: Masks matter. They save lives. https://t.co/Hc8lovKEwB
2020-10-06 00:17:00,I view wearing a mask as a patriotic duty — to protect those around you. #BidenTownHall
2020-10-06 00:09:00,Masks matter. They save lives.
2020-10-05 23:50:00,"I’m about to take the stage for tonight’s Town Hall in Miami, Florida. Tune in to @NBC now to watch live. https://t.co/iFo4jTtF2d"
2020-10-05 23:05:00,"Folks, starting today, I'm trying something new.

I'll be writing notes to you about my plans to build our country back better. And I'll be sharing personal stories and behind-the-scenes moments from the campaign trail, too.

I hope you'll follow along. https://t.co/OIjQQRO2I2"
2020-10-05 22:00:01,These good boys are ready to build bark better. https://t.co/OzaEkehJUR
2020-10-05 21:26:00,"Now that President Trump is busy tweeting campaign messages, I would ask him to do this: Listen to the scientists. Support masks. Support mask mandates nationwide."
2020-10-05 21:12:00,"Voting early in person starts today statewide in California, Iowa, Maine, Montana, Nebraska, and South Carolina.

This is our moment — and there is too much at stake to sit this election out.

Head to https://t.co/eoxT07uII9 to find all the info you need to make your voice heard."
2020-10-05 20:32:00,"Folks, if you live in:

Arizona
Arkansas
Florida
Georgia
Hawaii
Indiana
Kentucky
Mississippi
Ohio
South Carolina
Tennessee
Texas

Today is your last day to register to vote. Head to https://t.co/eoxT07d7QB to get registered before it's too late. https://t.co/Flq9HFKnc0"
2020-10-05 20:02:23,I’m in Florida to discuss my plans to build back our economy better for the Hispanic community and working families. Tune in. https://t.co/bKRYmvaH8O
2020-10-05 19:59:29,"RT @TeamJoe: We are 29 days away from Election Day, &amp; it’s the last day to register to vote in these states!

✅Arkansas
✅Arizona
✅Florida
✅…"
2020-10-05 16:54:00,https://t.co/eoxT07d7QB https://t.co/J6mYQG0oF2
2020-10-05 16:26:02,RT @TheDemocrats: You don’t have to wait until November 3 to cast your ballot. Be an #OctoberVoter. Make an early voting plan. https://t.co…
2020-10-05 16:25:35,"RT @HillaryClinton: Today is the deadline to register to vote in several states, including Arizona, Arkansas, Florida, Georgia, Ohio, and T…"
2020-10-05 14:00:01,"Imagine a future where:

- Health care is a right
- We end the gun violence epidemic
- We combat climate change
- Our government works for everyone

It’s a future that we can build — together."
2020-10-05 00:10:00,"The economy.
Climate change.
Health care.
Civil rights.
Racial justice.
The U.S. Supreme Court.
Our democracy.

They’re all on the line. Vote. https://t.co/eoxT07d7QB"
2020-10-04 22:32:00,It’s time we build an economy where everyone gets a fair return for their work and an equal chance to get ahead. An economy more vibrant and powerful because everyone is in on the deal. https://t.co/Tjgyn1gR2V
2020-10-04 21:01:00,"Today marks 30 days until Election Day. 30 days until we begin to restore the soul of the nation.

Chip in to power our campaign through this final stretch: https://t.co/v5RXu2WPlZ"
2020-10-04 19:05:00,"Before we're Democrats or Republicans or independents — we're Americans.

We can't forget that."
2020-10-04 17:20:00,"There are only 30 days until Election Day — but in many states, you don’t have to wait until November 3rd to make your voice heard. Head to https://t.co/eoxT07d7QB and make a plan to vote early today."
2020-10-04 15:30:00,30 days.
2020-10-04 14:05:00,"Receiving the Medal of Freedom from my friend @BarackObama was a great, great honor. I'm proud to have dedicated my life to serving this country — but I'm not done yet. https://t.co/NKEmYGOl6s"
2020-10-04 00:15:00,"At this moment, we’re facing unprecedented crises. But I know the American people have what it takes to overcome them.

There’s not a single thing beyond our capacity."
2020-10-03 23:23:00,"Folks, with just one month left until Election Day, voting is underway and there’s no time to wait to make your voice heard. Head to https://t.co/eoxT07uII9 to find everything you need to make your voting plan."
2020-10-03 22:07:00,"There’s just one month left before the most important election of our lifetime — one that will shape the future of our nation for decades to come.

Don’t wake up on November 4th wishing you had done more. Get involved today: https://t.co/gnaFCACYrW"
2020-10-03 20:37:00,One month until we can call @DrBiden our First Lady-Elect. https://t.co/Yi6wxsonYP
2020-10-03 19:15:00,"It's time we come together.

It's time we see each other as fellow Americans, who don't just live in red states and blue states, but who live in — and love — the United States of America.

That's who we are — and there is nothing we cannot do if we do it together."
2020-10-03 18:32:00,"One month until Election Day. Let’s do this, America."
2020-10-03 13:47:00,"Be a patriot. Do your part.

Wearing a mask will protect you. But it will also protect those around you — your mom, your dad, your son, your daughter, your neighbor, your co-worker.

Don’t just do it for yourself. Do it for the people you love."
2020-10-03 02:18:00,We have to come together. https://t.co/P8SkE6vkX1
2020-10-03 01:42:00,"Thank you, Grand Rapids, for a great afternoon. From the virus to the economy, we face immense challenges as a nation. But if we come together and act as one America, we can and will overcome them. https://t.co/eY5FVKRv3K"
2020-10-02 23:46:00,"I’m running as a Democrat, but I will be an American president. Whether you voted for me or against me, I will represent you."
2020-10-02 23:16:00,"We can, we will, and we must come together."
2020-10-02 21:56:00,"This cannot be a partisan moment.

It must be an American moment.

We have to come together as a nation."
2020-10-02 20:26:26,"I’m delivering remarks from Grand Rapids, Michigan. Tune in. https://t.co/LhZJjc4wIb"
2020-10-02 19:10:00,"Tonight, @BarackObama, @KamalaHarris, and @MichaelB4Jordan are hosting a grassroots fundraiser to discuss what's at stake this November and the importance of making your voice heard at the ballot box.

Chip in to reserve your spot: https://t.co/gWU2HX3G9R https://t.co/TiygIszVmE"
2020-10-02 16:22:43,"I’m happy to report that Jill and I have tested negative for COVID. Thank you to everyone for your messages of concern. I hope this serves as a reminder: wear a mask, keep social distance, and wash your hands."
2020-10-02 12:45:10,Jill and I send our thoughts to President Trump and First Lady Melania Trump for a swift recovery. We will continue to pray for the health and safety of the president and his family.
2020-10-02 00:40:00,"Donald Trump will do everything he can to distract from the fact that because of his failed COVID-19 response:

- Over 200,000 Americans have died
- 26 million are on unemployment
- 1 in 6 small businesses risk permanent closure

We can’t let him."
2020-10-01 23:18:00,"When I first ran for Senate, we put up a billboard that said, “Joe Biden: For all our families.”

It’s a motto that has guided me throughout my career.

It doesn’t matter if you’re a Democrat or Republican—I’ll be a president for all Americans, not just the ones who vote for me."
2020-10-01 22:35:00,"On Native Women's Equal Pay Day, we recognize the hard truth that Native women earn just $0.57 for every dollar a white man makes. It's unacceptable.

A Biden-Harris Administration will stand with women in Indian Country and pass legislation to close the gender wage gap. https://t.co/RstWRwFc2J"
2020-10-01 21:10:00,"During Filipino American History Month, we celebrate the community's immense contributions to our country — from early immigrants to the millions today, many who serve in the military or as frontline workers. As President, I'll work alongside them to protect the American people."
2020-10-01 20:20:00,"Three years ago today, Las Vegas was struck by tragedy when a gunman opened fire on the Route 91 Harvest Festival. It remains the deadliest mass shooting in modern U.S. history.

As we remember those we lost, we must take action to ensure it never happens again."
2020-10-01 19:08:00,Jill and I wish a happy Mid-Autumn Festival to all those celebrating. We join you in hoping for a future filled with peace and prosperity — and hope your festivities lead to a bountiful harvest in the year ahead.
2020-10-01 19:00:06,RT @ewarren: When news broke about Donald Trump’s taxes (or lack thereof)—a few of you asked me to break it down with my friend @KatiePorte…
2020-10-01 18:45:00,"Jill and I want to wish a very happy birthday to President Carter –– a patriot, a humanitarian, and a friend. Thank you for your tireless dedication to our country and to the world. https://t.co/SrajBmltek"
2020-10-01 17:40:00,"On behalf of Jill and our entire family, I want to wish the Korean-American community a happy Chuseok. May your celebrations be filled with laughter, joy, and plenty of good food. 행복한 한가위 보내세요!"
2020-10-01 16:36:00,"I paid my taxes.

These folks paid their taxes.

So why didn’t President Trump pay his? https://t.co/gcRWGnWF57"
2020-10-01 14:40:00,"You determine the outcome of this election — not Donald Trump.

Vote: https://t.co/eoxT07uII9"
2020-10-01 02:00:00,"It's safe to say I've gotten to know the hardworking men and women of @Amtrak over the years — I'm proud to stand with them as they face furloughs due to funding cuts.

These essential workers have kept us moving during this pandemic –– now it's time we have their backs. https://t.co/aoaTYZdhoF"
2020-10-01 01:42:00,"Last night, I went toe-to-toe with Donald Trump and laid out my vision for a stronger, more inclusive America. Check out a few of the top moments from the first debate: https://t.co/H1WFQIxU6y"
2020-10-01 01:02:00,"Folks, it all comes down to this. We’re just a few hours away from our final end-of-quarter deadline before Election Day — and we need your help to hit our goal.

It’s now or never. Chip in to help us beat Donald Trump: https://t.co/dammrUy8yd"
2020-10-01 00:19:33,"We're in Johnstown, Pennsylvania, for the final stop of the Build Back Better Express Tour. Tune in now to watch. https://t.co/WlSuLrlKFI"
2020-10-01 00:12:00,Last night reinforced why I got into this race: We are in a battle for the soul of this nation — and it’s a battle we must win.
2020-09-30 23:46:00,Chip in to help us take this train all the way to 1600 Pennsylvania Ave: https://t.co/i5hXFouYHi https://t.co/jzlKzUO0MJ
2020-09-30 23:19:50,"And do me a favor, make sure to select the train icon when you do. https://t.co/CMIaVb5BRX"
2020-09-30 23:19:49,"I'm giving everything I've got in these final 34 days to make sure we beat Donald Trump, but I can't do it without your help.

Join our grassroots fundraising team to help us win this November. https://t.co/T5CN04xsXo"
2020-09-30 22:30:00,"White supremacy has no place in America.

We shouldn’t have to beg the President of the United States to say that."
2020-09-30 21:52:17,"We're in Greensburg, Pennsylvania, for stop four of the Build Back Better Express Tour. Tune in now to watch. https://t.co/1NOIrJrvJd"
2020-09-30 21:48:00,"Ignore the polls, ignore his tweets, ignore his obnoxious debate performance.

We have to stay focused. We have to win.

Chip in to help us do it: https://t.co/qTfNFIRY9Y"
2020-09-30 21:21:00,"Hello, Greensburg! https://t.co/m7L9zdM8uF"
2020-09-30 19:59:00,Listening to folks and discussing how we can make their lives better. It’s what our Build Back Better Express Tour is all about — and it’s what I’ll do every day as your president. https://t.co/y6m8F2UnQy
2020-09-30 18:55:14,"We're in Pittsburgh, Pennsylvania, for stop three of the Build Back Better Express Tour. Tune in now to watch. https://t.co/KoGBkEKUxS"
2020-09-30 18:37:00,"Donald Trump showed the country last night just how unfit he is to be president. If you weren't able to bear watching it, we condensed it down to one minute for you: https://t.co/uopjSrldzn"
2020-09-30 18:02:00,"I took the Amtrak from Wilmington to Washington, D.C., every day for 36 years. The journey became routine, but the hardworking men and women I met along the way became dear friends. https://t.co/kyikjGKFQ9"
2020-09-30 17:46:00,"Enough with the racist dog whistles, Donald. You wouldn’t know a suburb unless you took a wrong turn. https://t.co/jodPtc0YDE"
2020-09-30 17:07:25,"RT @TeamJoe: Join @JoeBiden and @DrBiden as they travel by 🚂 through OH and PA. Along the way, listen to soothing tunes and watch the sceni…"
